{
  "$otSharedSchema": "#/pipette/schemas/2/pipetteLiquidPropertiesSchema.json",
  "supportedTips": {
    "t10": {
      "defaultAspirateFlowRate": 5.0,
      "defaultDispenseFlowRate": 10.0,
      "defaultBlowOutFlowRate": 1000.0,
      "defaultTipLength": 33.0,
      "defaultTipOverlap": 3.29,
      "defaultReturnTipHeight": null,
      "aspirate": {
        "opentrons/opentrons_96_tiprack_10ul/1": [
          [0.8649, 0.0374, 0.8484],
          [1.2416, -0.0987, 0.9503],
          [1.6053, -0.069, 0.9134],
          [1.9851, -0.0226, 0.839],
          [2.3481, -0.0313, 0.8561],
          [2.7207, -0.0143, 0.8164],
          [3.0702, -0.028, 0.8536],
          [4.5998, -0.0006, 0.7694],
          [6.1063, -0.0022, 0.7769],
          [7.6504, 0.0011, 0.7564],
          [9.1863, 0.0003, 0.7626],
          [10.7574, 0.0018, 0.7488],
          [12.2984, -0.4986, 6.1321]
        ],
        "opentrons/opentrons_96_filtertiprack_10ul/1": [
          [0.8649, 0.0374, 0.8484],
          [1.2416, -0.0987, 0.9503],
          [1.6053, -0.069, 0.9134],
          [1.9851, -0.0226, 0.839],
          [2.3481, -0.0313, 0.8561],
          [2.7207, -0.0143, 0.8164],
          [3.0702, -0.028, 0.8536],
          [4.5998, -0.0006, 0.7694],
          [6.1063, -0.0022, 0.7769],
          [7.6504, 0.0011, 0.7564],
          [9.1863, 0.0003, 0.7626],
          [10.7574, 0.0018, 0.7488],
          [12.2984, -0.4986, 6.1321]
        ],
        "opentrons/geb_96_tiprack_10ul/1": [
          [0.8649, 0.0374, 0.8484],
          [1.2416, -0.0987, 0.9503],
          [1.6053, -0.069, 0.9134],
          [1.9851, -0.0226, 0.839],
          [2.3481, -0.0313, 0.8561],
          [2.7207, -0.0143, 0.8164],
          [3.0702, -0.028, 0.8536],
          [4.5998, -0.0006, 0.7694],
          [6.1063, -0.0022, 0.7769],
          [7.6504, 0.0011, 0.7564],
          [9.1863, 0.0003, 0.7626],
          [10.7574, 0.0018, 0.7488],
          [12.2984, -0.4986, 6.1321]
        ],
        "opentrons/eppendorf_96_tiprack_10ul_eptips/1": [
          [0.8649, 0.0374, 0.8484],
          [1.2416, -0.0987, 0.9503],
          [1.6053, -0.069, 0.9134],
          [1.9851, -0.0226, 0.839],
          [2.3481, -0.0313, 0.8561],
          [2.7207, -0.0143, 0.8164],
          [3.0702, -0.028, 0.8536],
          [4.5998, -0.0006, 0.7694],
          [6.1063, -0.0022, 0.7769],
          [7.6504, 0.0011, 0.7564],
          [9.1863, 0.0003, 0.7626],
          [10.7574, 0.0018, 0.7488],
          [12.2984, -0.4986, 6.1321]
        ],
        "default": [
          [0.8649, 0.0374, 0.8484],
          [1.2416, -0.0987, 0.9503],
          [1.6053, -0.069, 0.9134],
          [1.9851, -0.0226, 0.839],
          [2.3481, -0.0313, 0.8561],
          [2.7207, -0.0143, 0.8164],
          [3.0702, -0.028, 0.8536],
          [4.5998, -0.0006, 0.7694],
          [6.1063, -0.0022, 0.7769],
          [7.6504, 0.0011, 0.7564],
          [9.1863, 0.0003, 0.7626],
          [10.7574, 0.0018, 0.7488],
          [12.2984, -0.4986, 6.1321]
        ]
      },
      "dispense": {
        "opentrons/opentrons_96_tiprack_10ul/1": [
          [12.74444519, 0.0, 0.8058688085]
        ],
        "opentrons/opentrons_96_filtertiprack_10ul/1": [
          [12.74444519, 0.0, 0.8058688085]
        ],
        "opentrons/geb_96_tiprack_10ul/1": [[12.74444519, 0.0, 0.8058688085]],
        "opentrons/eppendorf_96_tiprack_10ul_eptips/1": [
          [12.74444519, 0.0, 0.8058688085]
        ],
        "default": [[12.74444519, 0.0, 0.8058688085]]
      },
      "defaultTipOverlapDictionary": {
        "opentrons/opentrons_96_tiprack_10ul/1": 3.29,
        "opentrons/opentrons_96_filtertiprack_10ul/1": 3.29,
        "opentrons/geb_96_tiprack_10ul/1": 6.2,
        "opentrons/eppendorf_96_tiprack_10ul_eptips/1": 1.0
      }
    }
  },
  "maxVolume": 10,
  "minVolume": 1.0,
  "defaultTipracks": [
    "opentrons/opentrons_96_tiprack_10ul/1",
    "opentrons/opentrons_96_filtertiprack_10ul/1",
    "opentrons/geb_96_tiprack_10ul/1"
  ]
}
